<!ELEMENT HechosHistoricos (HechoHistorico)+>
        <!ELEMENT HechoHistorico (Fecha, Epoca?, PersonajeDestacado*)?>
        <!ELEMENT Epoca (Epoca1 | Epoca2)>
        <!ELEMENT Epoca1 (#PCDATA)>
        <!ELEMENT Epoca2 (#PCDATA)>
        <!ELEMENT PersonajeDestacado ANY>
        <!ELEMENT Nombre (#PCDATA)>
        <!ELEMENT FechaNacimiento (#PCDATA)>
        <!ELEMENT Fecha (#PCDATA | FormatoFecha)*>
        <!ELEMENT FormatoFecha (Dia,Mes,Año)>
        <!ELEMENT Dia (#PCDATA)>
        <!ELEMENT Mes (#PCDATA)>
        <!ELEMENT Año (#PCDATA)>
        <!ATTLIST HechoHistorico descripcion CDATA #REQUIRED>