<?xml version = "1.0" encoding = "UTF-8"?>

<!DOCTYPE HechosHistoricos SYSTEM "HechosHistoricos.dtd">

<HechosHistoricos>
    <HechoHistorico descripcion = "">
        <Fecha>
            <Dia></Dia>
            <Mes></Mes>
            <AÃ±o></AÃ±o>
        </Fecha>
        <Epoca>
            <Epoca1></Epoca1>
        </Epoca>
            <PersonajeDestacado>
                Test persona <Nombre></Nombre> y fecha de nacimiento <FechaNacimiento></FechaNacimiento>
            </PersonajeDestacado>
    </HechoHistorico>

</HechosHistoricos>